alert_text,category,source,severity,technique
"Encoded PowerShell command executed",Malware,Sysmon,Critical,T1059
"Suspicious executable downloaded from external server",Malware,Wazuh,Critical,T1204
"Known malware hash detected on endpoint",Malware,Wazuh,Critical,T1204
"Ransomware-like file encryption activity observed",Malware,Sysmon,Critical,T1486
"Malicious script execution detected",Malware,Sysmon,High,T1059
"Suspicious DLL loaded into process memory",Malware,Sysmon,High,T1055
"Payload downloaded and executed from remote location",Malware,Wazuh,Critical,T1105
"Trojan behavior detected on workstation",Malware,Wazuh,High,T1204
"Malicious macro execution detected in document",Malware,Sysmon,High,T1204
"Unauthorized binary executed from temporary directory",Malware,Wazuh,Medium,T1204